"babyfood, dinner, vegetables, noodles and chicken, strained",2.0,2.5,7.9,0.0,1.1,20.0
"babyfood, dinner, turkey and rice, junior",2.37,0.92,9.57,1.25,1.0,23.0
"babyfood, dinner, vegetables and turkey, strained",2.32,0.9,7.62,1.54,1.5,20.0
"babyfood, dinner, vegetables and turkey, junior",1.72,1.74,7.55,1.36,0.9,45.0
"babyfood, dinner, macaroni and cheese, strained",3.14,2.11,8.95,1.27,0.7,88.0
"babyfood, vegetable, green beans and potatoes",2.2,1.9,9.0,2.35,1.4,18.0
"babyfood, vegetables, beets, strained",1.3,0.1,7.7,6.09,1.9,83.0
"babyfood, vegetables, carrots, strained",0.8,0.1,6.0,3.64,1.7,69.0
"babyfood, vegetables, carrots, junior",0.8,0.2,7.2,3.16,1.7,49.0
"babyfood, potatoes, toddler",1.0,0.1,11.73,0.91,0.9,57.0
"babyfood, cereal, oatmeal, dry, gerber, single grain, fortified",10.94,6.42,73.57,12.27,7.0,23.0
"babyfood, vegetable, butternut squash and corn",2.0,0.6,9.26,2.93,2.0,5.0
"babyfood, apples, dices, toddler",0.19,0.36,11.56,10.48,1.9,2.0
"babyfood, fruit, applesauce, strained",0.2,0.2,10.8,9.87,1.7,0.0
"babyfood, dinner, vegetables and chicken, junior",2.04,1.12,8.66,1.46,1.1,34.0
"babyfood, dinner, mixed vegetable, strained",1.2,0.1,9.5,0.0,0.0,38.0
"babyfood, vegetables, mix vegetables strained",1.0,0.5,8.25,1.57,1.5,0.0
"babyfood, dinner, beef noodle, junior",2.5,1.9,7.3,1.45,1.1,26.0
"babyfood, apples with ham, strained",2.6,0.9,10.9,7.98,1.8,9.0
"babyfood, carrots and beef, strained",3.4,2.5,5.7,2.04,2.6,69.0
"babyfood, beverage, gerber, graduates, fruit splashers",0.0,0.0,7.35,6.12,0.0,11.0
"babyfood, snack, gerber, graduates, yogurt melts",14.29,4.0,71.82,57.14,2.3,286.0
"babyfood, dinner, sweet potatoes and chicken, strained",2.51,2.17,11.04,2.65,1.3,22.0
"infant formula, mead johnson, enfamil 24, ready to feed, with ara and dha",1.64,4.1,6.93,8.1,0.0,21.0
"infant formula, mead johnson, enfamil enspire powder, with ara and dha, not reconstituted",10.5,27.0,57.2,53.0,0.0,135.0
"infant formula, mead johnson, enfamil reguline, ready to feed, with ara and dha",1.51,3.5,7.6,3.8,0.0,24.0
"infant formula, mead johnson, gentlease, ready to feed, with ara and dha",1.5,3.5,7.61,1.93,0.0,0.0
"toddler formula, mead johnson, nutramigen toddler with lgg powder, with ara and dha, not reconstituted",12.0,21.0,61.97,25.0,0.0,178.0
"infant formula, mead johnson, pregestimil 20 calories, ready to feed, with ara and dha",1.84,3.7,7.0,0.02,0.0,31.0
"babyfood, cereal, high protein, prepared with whole milk",8.7,3.8,11.6,0.0,0.0,49.0
"babyfood, cereal, mixed, prepared with whole milk",4.14,3.38,12.3,4.78,0.8,42.0
"babyfood, cereal, mixed, with bananas, prepared with whole milk",3.82,3.46,10.0,5.9,0.4,48.0
"babyfood, cereal, oatmeal, prepared with whole milk",5.0,4.1,15.3,0.0,1.1,46.0
"babyfood, cereal, mixed, with honey, prepared with whole milk",5.0,3.6,15.9,0.0,0.0,48.0
"babyfood, cereal, high protein, with apple and orange, prepared with whole milk",6.9,3.9,13.4,0.0,0.0,58.0
"babyfood, cereal, rice, with bananas, prepared with whole milk",3.57,3.32,10.49,6.13,0.1,47.0
"infant formula, nestle, good start supreme, with iron, liquid concentrate, not reconstituted",2.79,6.5,14.2,9.7,0.0,34.0
"infant formula, nestle, good start supreme, with iron, powder",11.3,26.1,57.32,39.3,0.0,138.0
"infant formula, mead johnson, enfamil, lipil, low iron, liquid concentrate, with ara and dha",2.76,7.16,14.24,14.24,0.0,39.0
"infant formula, mead johnson, pregestimil, with iron, powder, with ara and dha, not reconstituted",14.0,28.0,52.2,4.1,0.0,240.0
"infant formula, mead johnson, pregestimil, with iron, with ara and dha, prepared from powder",1.86,3.7,6.54,0.53,0.0,31.0
"infant formula, mead johnson, prosobee, with iron, ready-to-feed",1.64,3.5,6.11,6.11,0.0,23.0
"infant formula, abbott nutrition, similac, isomil, with iron, ready-to-feed",1.61,3.59,6.7,6.7,0.0,29.0
"infant formula, abbott nutrition, similac, isomil, with iron, liquid concentrate",3.13,6.98,13.21,13.1,0.0,56.0
"infant formula, abbott nutrition, similac, isomil, with iron, powder, not reconstituted",12.6,28.09,53.57,52.97,0.0,226.0
"infant formula, mead johnson, enfamil, nutramigen, with iron, liquid concentrate not reconstituted, with ara and dha",1.84,3.5,7.2,7.0,0.0,31.0
"infant formula, mead johnson, enfamil, prosobee, with iron, powder, not reconstituted, with ara and dha",12.7,27.0,54.6,0.1,0.0,183.0
"infant formula, abbott nutrition, similac, with iron, powder, not reconstituted",10.89,28.87,54.73,54.73,0.0,126.0
"infant formula, mead johnson, enfamil, prosobee, liquid concentrate, reconstituted, with ara and dha",1.63,3.4,7.58,0.97,0.0,23.0
"infant formula, mead johnson, prosobee, with iron, ready to feed, with ara and dha",1.64,3.5,6.47,0.97,0.0,24.0
"infant formula, nestle, good start soy, with dha and ara, ready-to-feed",1.6,3.28,7.13,5.68,0.0,26.0
"child formula, abbott nutrition, pediasure, ready-to-feed, with iron and fiber",2.8,4.7,11.28,7.6,0.5,36.0
"infant formula, nestle, good start essentials soy, with iron, powder",12.5,25.5,55.7,44.38,0.0,180.0
"infant formula, mead johnson, next step prosobee, powder, not reconstituted",15.6,21.0,57.1,56.0,0.0,171.0
"infant formula, mead johnson,next step prosobee, prepared from powder",2.14,2.91,8.08,7.77,0.0,23.0
"infant formula, pbm products, store brand, powder",12.0,28.0,56.0,56.0,0.0,118.0
"infant formula, pbm products, store brand, soy, ready-to-feed",1.8,3.5,6.09,6.1,0.0,18.0
"infant formula, pbm products, store brand, soy, liquid concentrate, not reconstituted",3.6,7.0,12.18,12.18,0.0,36.0
"infant formula, pbm products, store brand, soy, powder",13.6,27.2,52.2,52.2,0.0,151.0
"infant formula, abbott nutrition, similac, sensitive, (lactose free), liquid concentrate, with ara and dha",2.73,6.95,13.64,13.78,0.0,39.0
"infant formula, abbott nutrition, similac, sensitive, (lactose free), powder, with ara and dha",11.13,28.14,55.67,55.67,0.0,158.0
"infant formula, abbott nutrition, similac, advance, with iron, ready-to-feed",1.36,3.7,6.77,6.77,0.0,16.0
"infant formula, abbott nutrition, similac, advance, with iron, powder, not reconstituted",10.89,28.87,54.73,54.73,0.0,126.0
"salad dressing, blue or roquefort cheese dressing, commercial, regular",1.37,51.1,4.77,3.48,0.4,642.0
"oil, cupu assu",0.0,100.0,0.0,0.0,0.0,0.0
"fat, chicken",0.0,99.8,0.0,0.0,0.0,0.0
"oil, soybean, salad or cooking, (partially hydrogenated) and cottonseed",0.0,100.0,0.0,0.0,0.0,0.0
"shortening industrial, lard and vegetable oil",0.0,100.0,0.0,0.0,0.0,0.0
"shortening frying (heavy duty), beef tallow and cottonseed",0.0,100.0,0.0,0.0,0.0,0.0
"shortening confectionery, coconut (hydrogenated) and or palm kernel (hydrogenated)",0.0,100.0,0.0,0.0,0.0,0.0
"shortening industrial, soybean (hydrogenated) and cottonseed",0.0,100.0,0.0,0.0,0.0,0.0
"oil, ucuhuba butter",0.0,100.0,0.0,0.0,0.0,0.0
"fat, turkey",0.0,99.8,0.0,0.0,0.0,0.0
"fat, goose",0.0,99.8,0.0,0.0,0.0,0.0
"oil, avocado",0.0,100.0,0.0,0.0,0.0,0.0
"shortening, special purpose for cakes and frostings, soybean (hydrogenated)",0.0,100.0,0.0,0.0,0.0,0.0
"shortening, special purpose for baking, soybean (hydrogenated) palm and cottonseed",0.0,100.0,0.0,0.0,0.0,0.0
"oil, oat",0.0,100.0,0.0,0.0,0.0,0.0
"fish oil, cod liver",0.0,100.0,0.0,0.0,0.0,0.0
"fish oil, sardine",0.0,100.0,0.0,0.0,0.0,0.0
"shortening, multipurpose, soybean (hydrogenated) and palm (hydrogenated)",0.0,100.0,0.0,0.0,0.0,0.0
"margarine-like, vegetable oil-butter spread, tub, with salt",1.0,40.0,1.0,0.0,0.0,786.0
"butter, light, stick, with salt",3.3,55.1,0.0,0.0,0.0,450.0
"margarine-like, vegetable oil spread, 60% fat, tub, with salt",0.17,59.81,0.86,0.0,0.0,615.0
"margarine-like, vegetable oil spread, 60% fat, stick/tub/bottle, with salt",0.6,59.17,0.0,0.0,0.0,700.0
"shortening, vegetable, household, composite",0.0,99.97,0.0,0.0,0.0,4.0
"margarine, regular, 80% fat, composite, stick, without salt",0.16,80.71,0.7,0.0,0.0,2.0
"margarine-like spread with yogurt, approximately 40% fat, tub, with salt",2.0,35.0,2.0,0.0,0.0,630.0
"margarine, 80% fat, stick, includes regular and hydrogenated corn and soybean oils",0.16,80.71,0.7,0.0,0.0,654.0
"margarine, margarine-type vegetable oil spread, 70% fat, soybean and partially hydrogenated soybean, stick",0.26,70.22,1.53,0.0,0.0,700.0
"margarine spread, 40-49% fat, tub",0.27,44.46,0.0,0.0,0.0,716.0
"salad dressing, italian dressing, fat-free",0.97,0.87,8.75,8.85,0.6,1129.0
"salad dressing, ranch dressing, fat-free",0.25,1.92,26.51,5.35,0.1,897.0
"salad dressing, ranch dressing, regular",1.32,44.54,5.9,4.69,0.0,901.0
"salad dressing, ranch dressing, reduced fat",1.25,12.42,21.33,3.77,1.1,1120.0
"salad dressing, mayonnaise, light",0.37,22.22,9.23,3.56,0.0,827.0
"oil, industrial, coconut, principal uses candy coatings, oil sprays, roasting nuts",0.0,100.0,0.0,0.0,0.0,0.0
"oil, industrial, soy (partially hydrogenated), principal uses popcorn and flavoring vegetables",0.0,100.0,0.0,0.0,0.0,0.0
"shortening, industrial, soy (partially hydrogenated), pourable liquid fry shortening",0.0,100.0,0.0,0.0,0.0,0.0
"oil, industrial, soy, refined, for woks and light frying",0.0,100.0,0.0,0.0,0.0,0.0
"margarine-like shortening, industrial, soy (partially hydrogenated), cottonseed, and soy, principal use flaky pastries",0.0,71.0,0.0,0.0,0.0,864.0
"oil, industrial, palm kernel, confection fat, uses similar to high quality cocoa butter",0.0,100.0,0.0,0.0,0.0,6.0
"oil, industrial, palm kernel (hydrogenated), confection fat, uses similar to 95 degree hard butter",0.0,100.0,0.0,0.0,0.0,6.0
"oil, industrial, palm kernel (hydrogenated), confection fat, intermediate grade product",0.0,100.0,0.0,0.0,0.0,6.0
"oil, industrial, palm kernel (hydrogenated), filling fat",0.0,100.0,0.0,0.0,0.0,6.0
"oil, industrial, soy (partially hydrogenated ), palm, principal uses icings and fillings",0.0,100.0,0.0,0.0,0.0,0.0
"margarine, industrial, non-dairy, cottonseed, soy oil (partially hydrogenated ), for flaky pastries",1.9,80.2,0.0,0.0,0.0,879.0
"shortening, industrial, soy (partially hydrogenated ) and corn for frying",0.0,100.0,0.0,0.0,0.0,0.0
"shortening, industrial, soy (partially hydrogenated ) for baking and confections",0.0,100.0,0.0,0.0,0.0,0.0
"margarine-like spread, smart beat super light without saturated fat",0.0,17.1,0.0,0.0,0.0,755.0
"margarine-like spread, smart beat smart squeeze",0.0,2.1,7.1,1.0,0.0,829.0
"margarine-like spread, smart balance omega plus spread (with plant sterols & fish oil)",0.13,70.95,0.16,0.0,0.0,729.0
"chicken, broilers or fryers, drumstick, meat and skin, cooked, fried, flour",26.96,13.72,1.63,0.0,0.1,89.0
"chicken, broilers or fryers, drumstick, meat and skin, cooked, roasted",23.35,10.15,0.0,0.0,0.0,123.0
"chicken, broilers or fryers, drumstick, meat and skin, cooked, stewed",25.32,10.64,0.0,0.0,0.0,76.0
"chicken, broilers or fryers, dark meat, drumstick, meat only, raw",19.41,3.71,0.0,0.0,0.0,114.0
"chicken, broilers or fryers, leg, meat and skin, cooked, fried, batter",21.77,16.17,8.72,0.0,0.3,279.0
"chicken, broilers or fryers, leg, meat and skin, cooked, fried, flour",26.84,14.43,2.5,0.0,0.1,88.0
"chicken, broilers or fryers, leg, meat and skin, cooked, roasted",24.03,8.99,0.0,0.0,0.0,98.0
"chicken, broilers or fryers, leg, meat and skin, cooked, stewed",24.17,12.92,0.0,0.0,0.0,73.0
"chicken, broilers or fryers, leg, meat only, raw",19.16,4.22,0.0,0.0,0.0,96.0
"chicken, broilers or fryers, neck, meat and skin, cooked, fried, batter",19.82,23.52,8.7,0.0,0.0,276.0
"chicken, broilers or fryers, neck, meat and skin, cooked, fried, flour",24.01,23.61,4.24,0.0,0.0,82.0
"chicken, broilers or fryers, neck, meat and skin, cooked simmered",19.61,18.1,0.0,0.0,0.0,52.0
"chicken, broilers or fryers, neck, meat only, raw",17.55,8.78,0.0,0.0,0.0,81.0
"chicken, broilers or fryers, thigh, meat and skin, cooked, fried, flour",26.75,14.98,3.18,0.0,0.1,88.0
"chicken, broilers or fryers, thigh, meat and skin, cooked, roasted",23.26,14.71,0.0,0.0,0.0,102.0
"chicken, broilers or fryers, thigh, meat and skin, cooked, stewed",23.26,14.74,0.0,0.0,0.0,71.0
"chicken, broilers or fryers, dark meat, thigh, meat only, raw",19.66,4.12,0.0,0.0,0.0,95.0
"chicken, broilers or fryers, wing, meat and skin, cooked, fried, batter",19.87,21.81,10.94,0.0,0.3,320.0
"chicken, broilers or fryers, wing, meat and skin, cooked, fried, flour",26.11,22.16,2.39,0.0,0.1,77.0
"chicken, broilers or fryers, wing, meat and skin, cooked, roasted",23.79,16.87,0.0,0.0,0.0,98.0
"chicken, broilers or fryers, wing, meat and skin, cooked, stewed",22.78,16.82,0.0,0.0,0.0,67.0
"chicken, broilers or fryers, wing, meat only, raw",21.97,3.54,0.0,0.0,0.0,81.0
"chicken, roasting, meat and skin and giblets and neck, cooked, roasted",23.96,13.07,0.05,0.0,0.0,71.0
"canada goose, breast meat only, skinless, raw",24.31,4.02,0.0,0.0,0.0,50.0
"chicken, roasting, meat and skin, cooked, roasted",23.97,13.39,0.0,0.0,0.0,73.0
"chicken, roasting, meat only, raw",20.33,2.7,0.0,0.0,0.0,75.0
"chicken, roasting, light meat, meat only, cooked, roasted",27.13,4.07,0.0,0.0,0.0,51.0
"chicken, roasting, dark meat, meat only, raw",18.74,3.61,0.0,0.0,0.0,95.0
"chicken, roasting, dark meat, meat only, cooked, roasted",23.25,8.75,0.0,0.0,0.0,95.0
"chicken, stewing, meat and skin, and giblets and neck, raw",17.48,19.52,0.19,0.0,0.0,71.0
"chicken, stewing, giblets, raw",17.89,9.21,2.13,0.0,0.0,77.0
"chicken, stewing, giblets, cooked, simmered",25.73,9.3,0.11,0.0,0.0,56.0
"chicken, stewing, light meat, meat only, raw",23.1,4.21,0.0,0.0,0.0,53.0
"chicken, stewing, light meat, meat only, cooked, stewed",33.04,7.98,0.0,0.0,0.0,58.0
"chicken, capons, meat and skin, raw",18.77,17.07,0.0,0.0,0.0,45.0
"chicken, capons, meat and skin, cooked, roasted",28.96,11.65,0.0,0.0,0.0,49.0
"beverages, water, tap, drinking",0.0,0.0,0.0,0.0,0.0,4.0
"beverages, coffee substitute, cereal grain beverage, powder, prepared with whole milk",3.3,3.3,5.6,0.0,0.1,49.0
"beverages, dairy drink mix, chocolate, reduced calorie, with low-calorie sweeteners, powder",25.0,2.6,51.4,32.94,9.4,659.0
"beverages, dairy drink mix, chocolate, reduced calorie, with aspartame, powder, prepared with water and ice",2.19,0.23,4.51,2.89,0.8,61.0
"beverages, orange-flavor drink, breakfast type, with pulp, frozen concentrate.",0.1,0.5,42.9,11.7,0.2,24.0
"beverages, orange-flavor drink, breakfast type, with pulp, frozen concentrate, prepared with water",0.03,0.14,12.21,11.91,0.0,10.0
"cranberry juice cocktail, frozen concentrate",0.05,0.0,51.45,42.5,0.2,4.0
"cranberry juice cocktail, frozen concentrate, prepared with water",0.01,0.0,11.81,9.76,0.0,4.0
"beverages, water, bottled, non-carbonated, dannon",0.0,0.0,0.0,0.0,0.0,0.0
"beverages, water, bottled, non-carbonated, pepsi, aquafina",0.0,0.0,0.0,0.0,0.0,0.0
"water, bottled, non-carbonated, naya",0.0,0.0,0.0,0.0,0.0,1.0
"beverages, dannon, water, bottled, non-carbonated, with fluoride",0.0,0.0,0.03,0.0,0.0,1.0
"beverages, drink mix, quaker oats, gatorade, orange flavor, powder",0.0,1.23,94.11,80.5,0.0,63.0
"beverages, pepsico quaker, gatorade, g performance o 2, ready-to-drink.",0.0,0.0,6.43,5.24,0.0,39.0
"whiskey sour mix, bottled, with added potassium and sodium",0.1,0.1,21.4,0.0,0.0,33.0
"alcoholic beverage, whiskey sour",0.0,0.03,13.17,0.0,0.0,20.0
"alcoholic beverage, distilled, all (gin, rum, vodka, whiskey) 94 proof",0.0,0.0,0.0,0.0,0.0,1.0
"alcoholic beverage, distilled, all (gin, rum, vodka, whiskey) 100 proof",0.0,0.0,0.0,0.0,0.0,1.0
"alcoholic beverage, liqueur, coffee, 63 proof",0.1,0.3,32.2,32.2,0.0,8.0
"lemonade, frozen concentrate, pink",0.22,0.69,48.86,46.46,0.3,4.0
"beverages, lemonade, frozen concentrate, pink, prepared with water",0.05,0.15,10.81,10.28,0.1,4.0
"fish, herring, atlantic, kippered",24.58,12.37,0.0,0.0,0.0,918.0
"fish, herring, pacific, raw",16.39,13.88,0.0,0.0,0.0,74.0
"fish, ling, raw",18.99,0.64,0.0,0.0,0.0,135.0
"fish, lingcod, raw",17.66,1.06,0.0,0.0,0.0,59.0
"fish, mackerel, pacific and jack, mixed species, raw",20.07,7.89,0.0,0.0,0.0,86.0
"fish, mackerel, spanish, raw",19.29,6.3,0.0,0.0,0.0,59.0
"fish, mackerel, spanish, cooked, dry heat",23.59,6.32,0.0,0.0,0.0,66.0
"fish, milkfish, raw",20.53,6.73,0.0,0.0,0.0,72.0
"fish, monkfish, raw",14.48,1.52,0.0,0.0,0.0,18.0
"fish, pout, ocean, raw",16.64,0.91,0.0,0.0,0.0,61.0
"fish, perch, mixed species, raw",19.39,0.92,0.0,0.0,0.0,62.0
"fish, perch, mixed species, cooked, dry heat",24.86,1.18,0.0,0.0,0.0,79.0
"fish, pike, northern, raw",19.26,0.69,0.0,0.0,0.0,39.0
"fish, pollock, alaska, cooked, dry heat (may contain additives to retain moisture)",23.48,1.18,0.0,0.0,0.0,419.0
"fish, pompano, florida, raw",18.48,9.47,0.0,0.0,0.0,65.0
"fish, pompano, florida, cooked, dry heat",23.69,12.14,0.0,0.0,0.0,76.0
"fish, rockfish, pacific, mixed species, raw",18.36,1.34,0.0,0.0,0.0,74.0
"fish, sablefish, smoked",17.65,20.14,0.0,0.0,0.0,737.0
"fish, salmon, atlantic, wild, raw",19.84,6.34,0.0,0.0,0.0,44.0
"fish, salmon, chinook, smoked",18.28,4.32,0.0,0.0,0.0,672.0
"fish, salmon, chinook, raw",19.93,10.43,0.0,0.0,0.0,47.0
"fish, salmon, chum, raw",20.14,3.77,0.0,0.0,0.0,50.0
"fish, salmon, pink, canned, total can contents",19.68,4.97,0.0,0.0,0.0,403.0
"fish, salmon, sockeye, raw",22.25,4.69,0.0,0.0,0.0,78.0
"fish, salmon, sockeye, cooked, dry heat",26.48,5.57,0.0,0.0,0.0,92.0
"fish, salmon, sockeye, canned, drained solids",23.59,7.39,0.0,0.0,0.0,408.0
"fish, sea bass, mixed species, cooked, dry heat",23.63,2.56,0.0,0.0,0.0,87.0
"fish, seatrout, mixed species, raw",16.74,3.61,0.0,0.0,0.0,58.0
"fish, shad, american, raw",16.93,13.77,0.0,0.0,0.0,51.0
"fish, shark, mixed species, raw",20.98,4.51,0.0,0.0,0.0,79.0
"fish, snapper, mixed species, raw",20.51,1.34,0.0,0.0,0.0,64.0
"fish, snapper, mixed species, cooked, dry heat",26.3,1.72,0.0,0.0,0.0,57.0
"fish, spot, raw",18.51,4.9,0.0,0.0,0.0,29.0
"fish, sturgeon, mixed species, raw",16.14,4.04,0.0,0.0,0.0,54.0
"fish, surimi",15.18,0.9,6.85,0.0,0.0,143.0
"fish, swordfish, raw",19.66,6.65,0.0,0.0,0.0,81.0
"fish, swordfish, cooked, dry heat",23.45,7.93,0.0,0.0,0.0,97.0
"fish, tilefish, raw",17.5,2.31,0.0,0.0,0.0,53.0
"fish, tuna, fresh, bluefin, raw",23.33,4.9,0.0,0.0,0.0,39.0
"fish, tuna, fresh, bluefin, cooked, dry heat",29.91,6.28,0.0,0.0,0.0,50.0
"fish, tuna, light, canned in oil, drained solids",29.13,8.21,0.0,0.0,0.0,416.0
"fish, tuna, light, canned in water, drained solids (includes foods for usda's food distribution program)",19.44,0.96,0.0,0.0,0.0,247.0
"fish, turbot, european, raw",16.05,2.95,0.0,0.0,0.0,150.0
"fish, whitefish, mixed species, raw",19.09,5.86,0.0,0.0,0.0,51.0
"fish, whitefish, mixed species, smoked",23.4,0.93,0.0,0.0,0.0,1019.0
"fish, whiting, mixed species, raw",18.31,1.31,0.0,0.0,0.0,72.0
"fish, catfish, channel, wild, cooked, dry heat",18.47,2.85,0.0,0.0,0.0,50.0
"fish, salmon, coho, farmed, raw",21.27,7.67,0.0,0.0,0.0,47.0
"fish, salmon, coho, farmed, cooked, dry heat",24.3,8.23,0.0,0.0,0.0,52.0
"fish, trout, rainbow, farmed, raw",19.94,6.18,0.0,0.0,0.0,51.0
"fish, trout, rainbow, farmed, cooked, dry heat",23.8,7.38,0.0,0.0,0.0,61.0
"fish, salmon, coho, wild, cooked, dry heat",23.45,4.3,0.0,0.0,0.0,58.0
"mollusks, conch, baked or broiled",26.3,1.2,1.7,0.0,0.0,153.0
"salmon nuggets, breaded, frozen, heated",12.69,11.72,13.96,0.0,0.0,173.0
"salmon nuggets, cooked as purchased, unheated",11.97,10.43,11.85,0.0,0.0,167.0
"salmon, sockeye, canned, drained solids, without skin and bones",26.33,5.87,0.0,0.0,0.0,386.0
"fish, salmon, pink, canned, drained solids, without skin and bones",24.62,4.21,0.0,0.0,0.0,378.0
"fish, pollock, alaska, raw",17.17,0.82,0.0,0.0,0.0,159.0
"fish, pollock, alaska, cooked",19.42,0.9946,0.0,0.0,0.0,166.0
"beans, adzuki, mature seeds, raw",19.87,0.53,62.9,0.0,12.7,5.0
"beans, adzuki, mature seeds, cooked, boiled, without salt",7.52,0.1,24.77,0.0,7.3,8.0
"beans, adzuki, mature seeds, canned, sweetened",3.8,0.03,55.01,0.0,0.0,218.0
"yokan, prepared from adzuki beans and sugar",3.29,0.12,60.72,0.0,0.0,83.0
"beans, baked, home prepared",5.54,5.15,21.63,0.0,5.5,422.0
"beans, baked, canned, with pork and sweet sauce",4.52,0.89,21.57,8.23,4.4,391.0
"beans, baked, canned, with pork and tomato sauce",5.15,0.93,18.69,5.67,4.0,437.0
"beans, black, mature seeds, raw",21.6,1.42,62.36,2.12,15.5,5.0
"beans, black, mature seeds, cooked, boiled, without salt",8.86,0.54,23.71,0.32,8.7,1.0
"beans, cranberry (roman), mature seeds, cooked, boiled, without salt",9.34,0.46,24.46,0.0,8.6,1.0
"beans, cranberry (roman), mature seeds, canned",5.54,0.28,15.12,0.0,6.3,332.0
"beans, french, mature seeds, raw",18.81,2.02,64.11,0.0,25.2,18.0
"beans, french, mature seeds, cooked, boiled, without salt",7.05,0.76,24.02,0.0,9.4,6.0
"beans, kidney, all types, mature seeds, cooked, boiled, without salt",8.67,0.5,22.8,0.32,6.4,1.0
"beans, kidney, all types, mature seeds, canned",5.22,0.6,14.5,1.85,4.3,296.0
"beans, kidney, california red, mature seeds, raw",24.37,0.25,59.8,0.0,24.9,11.0
"beans, kidney, california red, mature seeds, cooked, boiled, without salt",9.13,0.09,22.41,0.0,9.3,4.0
"beans, kidney, red, mature seeds, raw",22.53,1.06,61.29,2.1,15.2,12.0
"beans, navy, mature seeds, raw",22.33,1.5,60.75,3.88,15.3,5.0
"beans, navy, mature seeds, cooked, boiled, without salt",8.23,0.62,26.05,0.37,10.5,0.0
"beans, navy, mature seeds, canned",7.53,0.43,20.45,0.28,5.1,336.0
"beans, pink, mature seeds, raw",20.96,1.13,64.19,2.14,12.7,8.0
"beans, small white, mature seeds, raw",21.11,1.18,62.25,0.0,24.9,12.0
"beans, small white, mature seeds, cooked, boiled, without salt",8.97,0.64,25.81,0.0,10.4,2.0
"beans, yellow, mature seeds, raw",22.0,2.6,60.7,0.0,25.1,12.0
"beans, yellow, mature seeds, cooked, boiled, without salt",9.16,1.08,25.28,0.34,10.4,5.0
"broadbeans (fava beans), mature seeds, cooked, boiled, without salt",7.6,0.4,19.65,1.82,5.4,5.0
"broadbeans (fava beans), mature seeds, canned",5.47,0.22,12.41,0.0,3.7,453.0
carob flour,4.62,0.65,88.88,49.08,39.8,35.0
"chickpeas (garbanzo beans, bengal gram), mature seeds, raw",20.47,6.04,62.95,10.7,12.2,24.0
"chickpeas (garbanzo beans, bengal gram), mature seeds, cooked, boiled, without salt",8.86,2.59,27.42,4.8,7.6,7.0
"cowpeas, common (blackeyes, crowder, southern), mature seeds, raw",23.52,1.26,60.03,6.9,10.6,16.0
"cowpeas, common (blackeyes, crowder, southern), mature seeds, cooked, boiled, without salt",7.73,0.53,20.76,3.3,6.5,4.0
"cowpeas, common (blackeyes, crowder, southern), mature seeds, canned, plain",4.74,0.55,13.63,0.0,3.3,293.0
"cowpeas, common (blackeyes, crowder, southern), mature seeds, canned with pork",2.74,1.6,16.53,0.0,3.3,350.0
"vitasoy usa, organic nasoya extra firm tofu",10.1,5.2,2.6,0.4,1.3,4.0
"vitasoy usa, organic nasoya firm tofu",8.9,4.4,2.3,0.3,0.8,4.0
"vitasoy usa, organic nasoya silken tofu",4.8,2.5,1.4,0.2,0.3,2.0
"soymilk (all flavors), enhanced",2.94,1.99,3.45,2.53,0.4,50.0
"soymilk, original and vanilla, light, with added calcium, vitamins a and d",2.38,0.77,3.51,2.61,0.3,48.0
"soymilk, chocolate and other flavors, light, with added calcium, vitamins a and d",2.1,0.64,8.24,7.13,0.7,46.0
"soymilk, original and vanilla, light, unsweetened, with added calcium, vitamins a and d",2.62,0.85,3.85,0.41,0.6,63.0
"soymilk (all flavors), lowfat, with added calcium, vitamins a and d",1.65,0.62,7.2,3.5,0.8,37.0
"silk chocolate, soymilk",2.06,1.44,9.47,7.82,0.8,41.0
"silk light plain, soymilk",2.47,0.82,3.29,2.47,0.4,49.0
"silk light vanilla, soymilk",2.47,0.82,4.12,2.88,0.4,39.0
"silk light chocolate, soymilk",2.06,0.62,9.05,7.82,0.8,41.0
"silk very vanilla, soymilk",2.47,1.65,7.82,6.58,0.4,58.0
"silk nog, soymilk",2.46,1.64,12.3,9.84,0.0,61.0
"silk chai, soymilk",2.47,1.44,7.82,5.76,0.0,41.0
"silk mocha, soymilk",2.06,1.44,9.05,7.41,0.0,41.0
silk raspberry soy yogurt,2.35,1.18,17.65,12.94,0.6,15.0
silk peach soy yogurt,2.35,1.18,18.82,14.71,0.6,15.0
silk black cherry soy yogurt,2.35,1.18,17.06,11.76,0.6,12.0
silk blueberry soy yogurt,2.35,1.18,17.06,12.35,0.6,15.0
silk hazelnut creamer,0.0,6.67,20.0,20.0,0.0,67.0
"vitasoy usa organic nasoya, soft tofu",8.76,3.5,0.74,0.3,0.6,4.0
"vitasoy usa nasoya, lite silken tofu",8.21,1.1,0.0,0.0,0.0,79.0
"vitasoy usa organic nasoya, tofu plus extra firm",10.18,4.9,1.82,0.4,1.0,7.0
"vitasoy usa azumaya, silken tofu",4.82,2.4,0.58,0.2,0.2,2.0
house foods premium soft tofu,6.38,2.71,2.19,0.53,0.8,34.0
house foods premium firm tofu,10.92,4.19,0.97,0.4,0.9,33.0
"beans, adzuki, mature seed, cooked, boiled, with salt",7.52,0.1,24.77,0.0,7.3,244.0
"beans, great northern, mature seeds, cooked, boiled, with salt",8.33,0.45,21.09,0.0,7.0,238.0
"beans, great northern, mature seeds, canned, low sodium",7.37,0.39,21.02,1.41,4.9,177.0
"beans, kidney, all types, mature seeds, cooked, boiled, with salt",8.67,0.5,22.8,0.32,6.4,238.0
"beans, kidney, california red, mature seeds, cooked, boiled, with salt",9.13,0.09,22.41,0.0,9.3,240.0
"beans, navy, mature seeds, cooked, boiled, with salt",8.23,0.62,26.05,0.37,10.5,237.0
"beans, pink, mature seeds, cooked, boiled, with salt",9.06,0.49,27.91,0.36,5.3,238.0
"beans, pinto, mature seeds, cooked, boiled, with salt",9.01,0.65,26.22,0.34,9.0,238.0
"beans, pinto, mature seeds, canned, drained solids, rinsed in tap water",7.04,0.97,20.77,0.0,0.0,212.0
"broadbeans (fava beans), mature seeds, cooked, boiled, with salt",7.6,0.4,19.65,1.82,5.4,241.0
"chickpeas (garbanzo beans, bengal gram), mature seeds, cooked, boiled, with salt",8.86,2.59,27.42,4.8,7.6,243.0
"chickpeas (garbanzo beans, bengal gram), mature seeds, canned, drained solids",7.05,2.77,22.53,4.01,6.4,246.0
"chickpeas (garbanzo beans, bengal gram), mature seeds, canned, drained, rinsed in tap water",7.04,2.47,22.87,4.0,6.3,212.0
"lima beans, large, mature seeds, cooked, boiled, with salt",7.8,0.38,20.88,2.9,7.0,238.0
"lima beans, thin seeded (baby), mature seeds, cooked, boiled, with salt",8.04,0.38,23.31,0.0,7.7,239.0
"lupins, mature seeds, cooked, boiled, with salt",15.57,2.92,9.29,0.0,2.8,240.0
"mothbeans, mature seeds, cooked, boiled, with salt",7.81,0.55,20.96,0.0,0.0,246.0
